{
  "protocol_version": "0.3.0",
  "profile": "folderbase-reorganization-draft-v1",
  "id": "reorg_additive_folder",
  "generation": 1,
  "folderbase_id": "folderbase_example",
  "path_profile": "portable-case-sensitive-v1",
  "analysis_scope": {
    "manifest_sha256": "aaaaaaaaaaaaaaaaaaaaaaaaaaaaaaaaaaaaaaaaaaaaaaaaaaaaaaaaaaaaaaaa",
    "ignore_policy": {
      "expectation": "absent",
      "path": ".folderbaseignore"
    },
    "structural_policy": {
      "expectation": "absent",
      "path": ".folderbase/policy.json"
    },
    "nested_boundaries": [],
    "operation_closure": [
      {
        "expectation": "absent",
        "path": "Current"
      }
    ],
    "declared_entries": []
  },
  "questions": [],
  "rationale": "Add useful structure without imposing a template.",
  "operations": [
    {
      "kind": "create_directory",
      "path": "Current"
    }
  ]
}
